{"id":"http-geojson-default","version":1,"connectorTypeId":"http-geojson","name":"GeoJSON FeatureCollection","schemaVersion":1,"settings":{"endpoint":"https://example.org/data.geojson","sourceId":"example.features","sourceName":"Example features","attribution":"Example publisher","termsUrl":"https://example.org/terms","coverage":"Operator-declared feed coverage; completeness unverified.","identityProperty":"","labelProperty":"","sourceTimeProperty":"","validFromProperty":"","validToProperty":"","authentication":"none","pollSeconds":120}}
